{
  "totalRecords": 538,
  "meta": {
    "generatedAt": "2026-03-20T00:00:00Z",
    "source": "main_audit_geo_analytics_data + schedule/issue joins",
    "ratingLabels": [
      "Excellent",
      "Good",
      "Average",
      "Poor"
    ],
    "topLimit": 10
  },
  "overallPerformanceDistribution": {
    "description": "Overall audit rating split across all schedules.",
    "totalSchedules": 538,
    "ratingDistribution": [
      {
        "auditRating": "Excellent",
        "scheduleCount": 118,
        "percentOfTotal": 21.9
      },
      {
        "auditRating": "Good",
        "scheduleCount": 206,
        "percentOfTotal": 38.3
      },
      {
        "auditRating": "Average",
        "scheduleCount": 129,
        "percentOfTotal": 24
      },
      {
        "auditRating": "Poor",
        "scheduleCount": 85,
        "percentOfTotal": 15.8
      }
    ]
  },
  "clusterLevelPerformance": {
    "description": "Cluster-level view of schedule volume, average achieved score, issue load, and rating mix.",
    "totalClusters": 6,
    "items": [
      {
        "clusterName": "Avenue Road",
        "scheduleCount": 124,
        "averageAchievedScore": "",
        "issueCount": 231,
        "ratingDistribution": [
          {
            "auditRating": "Excellent",
            "scheduleCount": 20,
            "percentOfTotal": 16.1
          },
          {
            "auditRating": "Good",
            "scheduleCount": 44,
            "percentOfTotal": 35.5
          },
          {
            "auditRating": "Average",
            "scheduleCount": 34,
            "percentOfTotal": 27.4
          },
          {
            "auditRating": "Poor",
            "scheduleCount": 26,
            "percentOfTotal": 21
          }
        ]
      },
      {
        "clusterName": "Howrah Bridge",
        "scheduleCount": 102,
        "averageAchievedScore": "",
        "issueCount": 162,
        "ratingDistribution": [
          {
            "auditRating": "Excellent",
            "scheduleCount": 30,
            "percentOfTotal": 29.4
          },
          {
            "auditRating": "Good",
            "scheduleCount": 40,
            "percentOfTotal": 39.2
          },
          {
            "auditRating": "Average",
            "scheduleCount": 22,
            "percentOfTotal": 21.6
          },
          {
            "auditRating": "Poor",
            "scheduleCount": 10,
            "percentOfTotal": 9.8
          }
        ]
      },
      {
        "clusterName": "Mount Road",
        "scheduleCount": 94,
        "averageAchievedScore": "",
        "issueCount": 248,
        "ratingDistribution": [
          {
            "auditRating": "Excellent",
            "scheduleCount": 14,
            "percentOfTotal": 14.9
          },
          {
            "auditRating": "Good",
            "scheduleCount": 28,
            "percentOfTotal": 29.8
          },
          {
            "auditRating": "Average",
            "scheduleCount": 30,
            "percentOfTotal": 31.9
          },
          {
            "auditRating": "Poor",
            "scheduleCount": 22,
            "percentOfTotal": 23.4
          }
        ]
      },
      {
        "clusterName": "Harbour Line",
        "scheduleCount": 88,
        "averageAchievedScore": "",
        "issueCount": 132,
        "ratingDistribution": [
          {
            "auditRating": "Excellent",
            "scheduleCount": 24,
            "percentOfTotal": 27.3
          },
          {
            "auditRating": "Good",
            "scheduleCount": 38,
            "percentOfTotal": 43.2
          },
          {
            "auditRating": "Average",
            "scheduleCount": 18,
            "percentOfTotal": 20.5
          },
          {
            "auditRating": "Poor",
            "scheduleCount": 8,
            "percentOfTotal": 9.1
          }
        ]
      },
      {
        "clusterName": "River Front",
        "scheduleCount": 70,
        "averageAchievedScore": "",
        "issueCount": 109,
        "ratingDistribution": [
          {
            "auditRating": "Excellent",
            "scheduleCount": 16,
            "percentOfTotal": 22.9
          },
          {
            "auditRating": "Good",
            "scheduleCount": 26,
            "percentOfTotal": 37.1
          },
          {
            "auditRating": "Average",
            "scheduleCount": 18,
            "percentOfTotal": 25.7
          },
          {
            "auditRating": "Poor",
            "scheduleCount": 10,
            "percentOfTotal": 14.3
          }
        ]
      },
      {
        "clusterName": "Industrial Ring",
        "scheduleCount": 60,
        "averageAchievedScore": "",
        "issueCount": 46,
        "ratingDistribution": [
          {
            "auditRating": "Excellent",
            "scheduleCount": 14,
            "percentOfTotal": 23.3
          },
          {
            "auditRating": "Good",
            "scheduleCount": 30,
            "percentOfTotal": 50
          },
          {
            "auditRating": "Average",
            "scheduleCount": 7,
            "percentOfTotal": 11.7
          },
          {
            "auditRating": "Poor",
            "scheduleCount": 9,
            "percentOfTotal": 15
          }
        ]
      }
    ]
  },
  "auditeeTypeAnalysis": {
    "description": "Rating distribution, average achieved score, and issue count grouped by auditee type category (e.g. Branch, Regional Office). Not to be confused with audit template names.",
    "totalAuditeeTypes": 4,
    "items": [
      {
        "auditeeType": "Branch",
        "scheduleCount": 318,
        "averageAchievedScore": "",
        "issueCount": 548,
        "ratingDistribution": [
          {
            "auditRating": "Excellent",
            "scheduleCount": 64,
            "percentOfTotal": 20.1
          },
          {
            "auditRating": "Good",
            "scheduleCount": 124,
            "percentOfTotal": 39
          },
          {
            "auditRating": "Average",
            "scheduleCount": 78,
            "percentOfTotal": 24.5
          },
          {
            "auditRating": "Poor",
            "scheduleCount": 52,
            "percentOfTotal": 16.4
          }
        ]
      },
      {
        "auditeeType": "Regional Office",
        "scheduleCount": 104,
        "averageAchievedScore": "",
        "issueCount": 216,
        "ratingDistribution": [
          {
            "auditRating": "Excellent",
            "scheduleCount": 18,
            "percentOfTotal": 17.3
          },
          {
            "auditRating": "Good",
            "scheduleCount": 40,
            "percentOfTotal": 38.5
          },
          {
            "auditRating": "Average",
            "scheduleCount": 28,
            "percentOfTotal": 26.9
          },
          {
            "auditRating": "Poor",
            "scheduleCount": 18,
            "percentOfTotal": 17.3
          }
        ]
      },
      {
        "auditeeType": "Corporate Office",
        "scheduleCount": 72,
        "averageAchievedScore": "",
        "issueCount": 98,
        "ratingDistribution": [
          {
            "auditRating": "Excellent",
            "scheduleCount": 22,
            "percentOfTotal": 30.6
          },
          {
            "auditRating": "Good",
            "scheduleCount": 28,
            "percentOfTotal": 38.9
          },
          {
            "auditRating": "Average",
            "scheduleCount": 14,
            "percentOfTotal": 19.4
          },
          {
            "auditRating": "Poor",
            "scheduleCount": 8,
            "percentOfTotal": 11.1
          }
        ]
      },
      {
        "auditeeType": "Warehouse",
        "scheduleCount": 44,
        "averageAchievedScore": "",
        "issueCount": 66,
        "ratingDistribution": [
          {
            "auditRating": "Excellent",
            "scheduleCount": 14,
            "percentOfTotal": 31.8
          },
          {
            "auditRating": "Good",
            "scheduleCount": 14,
            "percentOfTotal": 31.8
          },
          {
            "auditRating": "Average",
            "scheduleCount": 9,
            "percentOfTotal": 20.5
          },
          {
            "auditRating": "Poor",
            "scheduleCount": 7,
            "percentOfTotal": 15.9
          }
        ]
      }
    ]
  },
  "auditeeLevelHotspots": {
    "description": "Top 10 individual auditees by schedule count with rating mix, issue load, and average achieved score.",
    "topLimit": 10,
    "items": [
      {
        "auditeeName": "M G Road",
        "auditeeType": "Branch",
        "clusterName": "Avenue Road",
        "scheduleCount": 18,
        "averageAchievedScore": "",
        "issueCount": 42,
        "ratingDistribution": [
          {
            "auditRating": "Excellent",
            "scheduleCount": 2,
            "percentOfTotal": 11.1
          },
          {
            "auditRating": "Good",
            "scheduleCount": 6,
            "percentOfTotal": 33.3
          },
          {
            "auditRating": "Average",
            "scheduleCount": 5,
            "percentOfTotal": 27.8
          },
          {
            "auditRating": "Poor",
            "scheduleCount": 5,
            "percentOfTotal": 27.8
          }
        ]
      },
      {
        "auditeeName": "Richmond Circle",
        "auditeeType": "Branch",
        "clusterName": "Avenue Road",
        "scheduleCount": 16,
        "averageAchievedScore": "",
        "issueCount": 29,
        "ratingDistribution": [
          {
            "auditRating": "Excellent",
            "scheduleCount": 3,
            "percentOfTotal": 18.8
          },
          {
            "auditRating": "Good",
            "scheduleCount": 5,
            "percentOfTotal": 31.2
          },
          {
            "auditRating": "Average",
            "scheduleCount": 5,
            "percentOfTotal": 31.2